{
  "schemaVersion": 1,
  "id": "arduino.uno-r3",
  "name": "Arduino Uno R3",
  "sketch": {
    "path": "boards/arduino-uno-r3.ino",
    "fqbn": "arduino:avr:uno"
  },
  "detect": {
    "usb": [
      {
        "vid": "2341",
        "pid": "0043",
        "confidence": "exact",
        "manufacturerAliases": ["Arduino", "Arduino LLC", "Arduino (www.arduino.cc)"],
        "productAliases": ["Arduino Uno", "Arduino Uno R3", "Arduino Uno Rev3"]
      },
      {
        "vid": "2341",
        "pid": "0001",
        "confidence": "exact",
        "manufacturerAliases": ["Arduino", "Arduino LLC", "Arduino (www.arduino.cc)"],
        "productAliases": ["Arduino Uno", "Arduino Uno R3", "Arduino Uno Rev3"]
      },
      {
        "vid": "2a03",
        "pid": "0043",
        "confidence": "exact",
        "manufacturerAliases": ["Arduino", "Arduino SRL", "Arduino (www.arduino.cc)"],
        "productAliases": ["Arduino Uno", "Arduino Uno R3", "Arduino Uno Rev3"]
      },
      {
        "vid": "2341",
        "pid": "0243",
        "confidence": "exact",
        "manufacturerAliases": ["Arduino", "Arduino LLC", "Arduino (www.arduino.cc)"],
        "productAliases": ["Arduino Uno", "Arduino Uno R3", "Arduino Uno Rev3"]
      },
      {
        "vid": "2341",
        "pid": "006a",
        "confidence": "exact",
        "manufacturerAliases": ["Arduino", "Arduino LLC", "Arduino (www.arduino.cc)"],
        "productAliases": ["Arduino Uno", "Arduino Uno R3", "Arduino Uno Rev3"]
      }
    ]
  },
  "wiring": [
    {
      "from": "D2",
      "to": "순간 누름 스위치 NO 단자",
      "note": "스위치 COM 단자는 GND에 연결"
    },
    {
      "from": "D9",
      "to": "LED 양극",
      "note": "220~330Ω 직렬 저항을 사용하고 LED 음극은 GND에 연결"
    }
  ]
}
