{
  "schemaVersion": 1,
  "id": "arduino.uno-r3-ch340",
  "name": "Arduino Uno R3 호환 보드 (CH340)",
  "sketch": {
    "path": "boards/arduino-uno-r3-ch340.ino",
    "fqbn": "arduino:avr:uno"
  },
  "detect": {
    "usb": [
      {
        "vid": "1a86",
        "pid": "7523",
        "confidence": "ambiguous"
      },
      {
        "vid": "1a86",
        "pid": "7522",
        "confidence": "ambiguous"
      },
      {
        "vid": "1a86",
        "pid": "5523",
        "confidence": "ambiguous"
      }
    ]
  },
  "wiring": [
    {
      "from": "D2",
      "to": "순간 누름 스위치 NO 단자",
      "note": "스위치 COM 단자는 GND에 연결"
    },
    {
      "from": "D9",
      "to": "LED 양극",
      "note": "220~330Ω 직렬 저항을 사용하고 LED 음극은 GND에 연결"
    }
  ]
}
